{
  "manifest_version": "1.0",
  "run_id": "qf-run-1-soap-20261009T172617Z",
  "recorded_at": "2026-10-09T17:50:51Z",
  "recorded_by": "testing_agent",
  "test_files": [
    {
      "path": "qualityforge/generated/tests/test_soap_evaluator.py",
      "sha256": "0d4cae6d64c9dd94be75304502155449e8dff20f6e39c2112cb42d4d96129f77",
      "bytes": 9597,
      "criteria_refs": [
        "AC-01",
        "AC-02",
        "AC-03",
        "AC-04",
        "AC-05",
        "AC-06",
        "AC-07",
        "AC-08"
      ]
    },
    {
      "path": "qualityforge/generated/tests/conftest.py",
      "sha256": "7547868112168a07244bf743fcf828e264de21931e37e3fc8d11ce68d7ea50f4",
      "bytes": 1689
    },
    {
      "path": "qualityforge/generated/tests/__init__.py",
      "sha256": "c212e8d3e0f9b98bb768fb6d58407bdaa0acbbd16aab3123e80d3f394b2a6ae4",
      "bytes": 63
    }
  ]
}
